schema_version,run_id,agent_id,agent_version,request_index,skill_index,skill_name,skill_file,source_path,definition_chars,definition_tokens,description,preview
hibench.benchmark.v1,codex-0.140.0-hi,codex,0.140.0,1,1,imagegen,/codex-home/skills/.system/imagegen/SKILL.md,input.0.content.1.text,635,132,"Generate or edit raster images when the task benefits from AI-created bitmap visuals such as photos, illustrations, textures, sprites, mockups, or transparent-background cutouts. Use when Codex should create a brand-new image, transform an existing image, or derive visual variants from references, and the output should be a bitmap asset rather than repo-native code or vector. Do not use when the task is better handled by editing existing SVG/vector/code-native assets, extending an established icon or logo system, or building the visual directly in HTML/CSS/canvas.","- imagegen: Generate or edit raster images when the task benefits from AI-created bitmap visuals such as photos, illustr"
hibench.benchmark.v1,codex-0.140.0-hi,codex,0.140.0,1,2,openai-docs,/codex-home/skills/.system/openai-docs/SKILL.md,input.0.content.1.text,518,119,"Use when the user asks how to build with OpenAI products or APIs, asks about Codex itself or choosing Codex surfaces, needs up-to-date official documentation with citations, help choosing the latest model for a use case, or model upgrade and prompt-upgrade guidance; use OpenAI docs MCP tools for non-Codex docs questions, use the Codex manual helper first for broad Codex self-knowledge, and restrict fallback browsing to official OpenAI domains.","- openai-docs: Use when the user asks how to build with OpenAI products or APIs, asks about Codex itself or choosing Cod"
hibench.benchmark.v1,codex-0.140.0-hi,codex,0.140.0,1,3,plugin-creator,/codex-home/skills/.system/plugin-creator/SKILL.md,input.0.content.1.text,548,106,"Create and scaffold plugin directories for Codex with a required `.codex-plugin/plugin.json`, optional plugin folders/files, valid manifest defaults, and personal-marketplace entries by default. Use when Codex needs to create a new personal plugin, add optional plugin structure, generate or update marketplace entries for plugin ordering and availability metadata, or update an existing local plugin during development with the CLI-driven cachebuster and reinstall flow.","- plugin-creator: Create and scaffold plugin directories for Codex with a required `.codex-plugin/plugin.json`, optional"
hibench.benchmark.v1,codex-0.140.0-hi,codex,0.140.0,1,4,skill-creator,/codex-home/skills/.system/skill-creator/SKILL.md,input.0.content.1.text,300,67,"Guide for creating effective skills. This skill should be used when users want to create a new skill (or update an existing skill) that extends Codex's capabilities with specialized knowledge, workflows, or tool integrations.",- skill-creator: Guide for creating effective skills. This skill should be used when users want to create a new skill (o
hibench.benchmark.v1,codex-0.140.0-hi,codex,0.140.0,1,5,skill-installer,/codex-home/skills/.system/skill-installer/SKILL.md,input.0.content.1.text,304,75,"Install Codex skills into $CODEX_HOME/skills from a curated list or a GitHub repo path. Use when a user asks to list installable skills, install a curated skill, or install a skill from another repo (including private repos).",- skill-installer: Install Codex skills into $CODEX_HOME/skills from a curated list or a GitHub repo path. Use when a us
